[
  {
    "claim_id": "demo_claim_finance_price",
    "evidence_id": "demo_evidence_synthetic",
    "title": "차주 단위 대출 한도 축소의 단기 매수 수요 억제 경로 (합성 예시)",
    "policy_type": "finance",
    "target_region": "demo_region",
    "sample_period": {
      "start": "2020-01-01",
      "end": "2024-12-31"
    },
    "outcome_metric": "housing_price_index",
    "effect_direction": "decrease",
    "effect_semantics": "synthetic_demo_placeholder",
    "effect_value": null,
    "lower_bound": null,
    "upper_bound": null,
    "unit": null,
    "horizon_months": 6,
    "horizon_class": "short_to_medium_run",
    "is_quantitative_candidate": false,
    "scenario_match": "PARTIAL_MATCH",
    "method": "synthetic_demo_placeholder",
    "market_regime": "demo_unspecified",
    "evidence_grade": "D",
    "mechanisms": ["borrowing_capacity", "buyer_demand"],
    "limitations": [
      "이 레코드는 데이터 스키마 검증용 합성 예시이며 실제 연구 수치가 아닙니다.",
      "실제 근거는 아래 KDI 및 한국은행 연구 보고서에서 추출한 조건부 Claim 레코드를 참조하십시오."
    ],
    "source": {
      "title": "PolicyMap Synthetic Claim Fixture",
      "publisher": "PolicyMap Demo",
      "url": "https://example.invalid/policymap/demo-claim",
      "published_at": "2025-06-28",
      "series": "Synthetic Validation Fixture",
      "source_type": "synthetic",
      "review_status": "synthetic_fixture",
      "locator": "Fixture 0"
    }
  },
  {
    "claim_id": "CL-KDI23-LTP-VOLUME-DIRECT",
    "evidence_id": "EV-KDI-2023-06",
    "title": "토지거래허가구역 지정 지역의 아파트 거래량 직접 감소 효과",
    "policy_type": "land_transaction_permit",
    "target_region": "11680,11710",
    "sample_period": {
      "start": "2020-06-23",
      "end": "2022-06-30"
    },
    "outcome_metric": "transaction_volume",
    "effect_direction": "decrease",
    "effect_semantics": "direct_empirical",
    "effect_value": -38.3,
    "lower_bound": null,
    "upper_bound": null,
    "unit": "percent",
    "horizon_months": 12,
    "horizon_class": "short_to_medium_run",
    "is_quantitative_candidate": true,
    "scenario_match": "MATCHED",
    "method": "difference_in_differences_spatial_discontinuity",
    "market_regime": "low_rate_expansion_to_tightening_2020_2022",
    "evidence_grade": "B",
    "mechanisms": [
      "transaction_eligibility",
      "residency_obligation",
      "investor_demand"
    ],
    "related_claims": [
      {
        "claim_id": "CL-KDI23-LTP-PRICE-DIRECT",
        "relation": "COMPLEMENTS",
        "reason": "동일한 토지거래허가구역 지정 사건에서 거래량 급감과 단기 가격 조정이 동반됨을 보여줍니다."
      },
      {
        "claim_id": "CL-KDI23-LTP-PRICE-SPILLOVER",
        "relation": "COMPLEMENTS",
        "reason": "직접 규제 구역의 거래 위축이 인접 비규제 지역의 풍선효과와 동시에 발생함을 설명합니다."
      }
    ],
    "limitations": [
      "2020년 6월 잠실, 삼성, 대치, 청담 지정 사례를 기반으로 추정된 값입니다.",
      "KDI 2025년 후속 해설(EV-KDI-2025-COLUMN, 등급 D)에 따르면 지정 2년 경과 후에도 거래량 감소는 지속되나 가격 안정 효과는 감쇠하는 양상이 관찰됩니다.",
      "원문 본문 표의 표준오차 및 신뢰구간은 추가 검증 전까지 비워 둡니다."
    ],
    "source": {
      "title": "주택시장과 규제",
      "publisher": "한국개발연구원(KDI)",
      "url": "https://www.kdi.re.kr/research/reportView?pub_no=18385",
      "published_at": "2023-12-30",
      "series": "연구보고서 2023-06",
      "source_type": "research_report",
      "review_status": "abstract_verified_pdf_tables_pending",
      "locator": "요약 및 제2장 토지거래허가제 효과 분석"
    }
  },
  {
    "claim_id": "CL-KDI23-LTP-PRICE-DIRECT",
    "evidence_id": "EV-KDI-2023-06",
    "title": "토지거래허가구역 지정 지역의 아파트 매매가격 직접 하락 효과",
    "policy_type": "land_transaction_permit",
    "target_region": "11680,11710",
    "sample_period": {
      "start": "2020-06-23",
      "end": "2022-06-30"
    },
    "outcome_metric": "housing_price_index",
    "effect_direction": "decrease",
    "effect_semantics": "direct_empirical",
    "effect_value": -4.3,
    "lower_bound": null,
    "upper_bound": null,
    "unit": "percent",
    "horizon_months": 12,
    "horizon_class": "short_to_medium_run",
    "is_quantitative_candidate": true,
    "scenario_match": "MATCHED",
    "method": "difference_in_differences_spatial_discontinuity",
    "market_regime": "low_rate_expansion_to_tightening_2020_2022",
    "evidence_grade": "B",
    "mechanisms": ["transaction_eligibility", "investor_demand"],
    "related_claims": [
      {
        "claim_id": "CL-KDI23-LTP-PRICE-SPILLOVER",
        "relation": "COMPLEMENTS",
        "reason": "규제 구역 내 가격 하락(-4.3%)과 인접 비규제 구역 가격 상승(+2.3%)이 한 쌍으로 작동합니다."
      }
    ],
    "limitations": [
      "실거주 의무 부과로 갭투자 수요가 차단된 직접 규제 행정동에 한정된 결과입니다.",
      "KDI 2025년 후속 해설(EV-KDI-2025-COLUMN, 등급 D)은 지정 2년 이후 규제 지역과 비규제 지역 간 가격 격차가 통계적으로 유의하지 않게 축소되었다고 지적합니다."
    ],
    "source": {
      "title": "주택시장과 규제",
      "publisher": "한국개발연구원(KDI)",
      "url": "https://www.kdi.re.kr/research/reportView?pub_no=18385",
      "published_at": "2023-12-30",
      "series": "연구보고서 2023-06",
      "source_type": "research_report",
      "review_status": "abstract_verified_pdf_tables_pending",
      "locator": "요약 및 제2장 토지거래허가제 직접 가격 효과"
    }
  },
  {
    "claim_id": "CL-KDI23-LTP-PRICE-SPILLOVER",
    "evidence_id": "EV-KDI-2023-06",
    "title": "토지거래허가구역 인접 비규제 지역의 매매가격 풍선효과",
    "policy_type": "land_transaction_permit",
    "target_region": "11200,11440,11740,41135,41290",
    "sample_period": {
      "start": "2020-06-23",
      "end": "2022-06-30"
    },
    "outcome_metric": "adjacent_housing_price_index",
    "effect_direction": "increase",
    "effect_semantics": "spillover_empirical",
    "effect_value": 2.3,
    "lower_bound": null,
    "upper_bound": null,
    "unit": "percent",
    "horizon_months": 12,
    "horizon_class": "short_to_medium_run",
    "is_quantitative_candidate": true,
    "scenario_match": "MATCHED",
    "method": "difference_in_differences_spatial_discontinuity",
    "market_regime": "low_rate_expansion_to_tightening_2020_2022",
    "evidence_grade": "B",
    "mechanisms": ["spatial_substitution", "buyer_demand"],
    "related_claims": [
      {
        "claim_id": "CL-KDI23-LTP-PRICE-DIRECT",
        "relation": "COMPLEMENTS",
        "reason": "직접 규제 구역에서 이탈한 매수 및 투자 수요가 인접 비규제 구역으로 이동한 결과입니다."
      }
    ],
    "limitations": [
      "행정동 경계 인접 비규제 아파트를 대상으로 측정된 풍선효과이며, 지정 범위가 구 단위 전체로 넓어질 경우 전이 대상 지역이 성동구, 마포구, 강동구, 분당구, 과천시 등 외곽 대체지로 이동할 수 있습니다(EV-KDI-2025-COLUMN 보완 맥락)."
    ],
    "source": {
      "title": "주택시장과 규제",
      "publisher": "한국개발연구원(KDI)",
      "url": "https://www.kdi.re.kr/research/reportView?pub_no=18385",
      "published_at": "2023-12-30",
      "series": "연구보고서 2023-06",
      "source_type": "research_report",
      "review_status": "abstract_verified_pdf_tables_pending",
      "locator": "요약 및 제2장 인접 지역 풍선효과 분석"
    }
  },
  {
    "claim_id": "CL-KDI23-PRICECAP-SUPPLY",
    "evidence_id": "EV-KDI-2023-06",
    "title": "민간택지 분양가상한제 지정 이후 단기 주택 공급 감소 미확인",
    "policy_type": "presale_price_cap",
    "target_region": "11",
    "sample_period": {
      "start": "2019-11-01",
      "end": "2022-12-31"
    },
    "outcome_metric": "new_housing_supply",
    "effect_direction": "unknown",
    "effect_semantics": "unknown_with_no_detected_decrease",
    "effect_value": null,
    "lower_bound": null,
    "upper_bound": null,
    "unit": null,
    "horizon_months": 24,
    "horizon_class": "short_to_medium_run",
    "is_quantitative_candidate": false,
    "scenario_match": "PARTIAL_MATCH",
    "method": "empirical_supply_comparison",
    "market_regime": "seoul_presale_cap_designation_2019_2022",
    "evidence_grade": "B",
    "mechanisms": ["developer_supply_incentive"],
    "limitations": [
      "관측 기간 내 유의한 공급 감소가 확인되지 않았다는 결과이므로, 효과가 0이라고 단정하지 않고 미확인 상태로 보존합니다.",
      "정비사업 인허가부터 준공까지의 장기 시차(5년 이상)는 표본 기간에 완전히 반영되지 않았습니다."
    ],
    "source": {
      "title": "주택시장과 규제",
      "publisher": "한국개발연구원(KDI)",
      "url": "https://www.kdi.re.kr/research/reportView?pub_no=18385",
      "published_at": "2023-12-30",
      "series": "연구보고서 2023-06",
      "source_type": "research_report",
      "review_status": "abstract_verified_pdf_tables_pending",
      "locator": "요약 및 제3장 분양가상한제 공급 효과 분석"
    }
  },
  {
    "claim_id": "CL-KDI23-LEASE-DEPOSIT-KR",
    "evidence_id": "EV-KDI-2023-06",
    "title": "주택임대차보호법(계약갱신청구권 및 전월세상한제) 도입 직후 전국 전세보증금 상승",
    "policy_type": "lease_protection_act",
    "target_region": "KR",
    "sample_period": {
      "start": "2020-07-31",
      "end": "2022-07-31"
    },
    "outcome_metric": "jeonse_deposit",
    "effect_direction": "increase",
    "effect_semantics": "direct_empirical",
    "effect_value": 0.97,
    "lower_bound": null,
    "upper_bound": null,
    "unit": "percent",
    "horizon_months": 1,
    "horizon_class": "immediate",
    "is_quantitative_candidate": true,
    "scenario_match": "PARTIAL_MATCH",
    "method": "event_window_regression",
    "market_regime": "low_rate_jeonse_scarcity_2020",
    "evidence_grade": "C",
    "mechanisms": ["renewal_option_pricing", "jeonse_supply"],
    "related_claims": [
      {
        "claim_id": "CL-KDI23-LEASE-DEPOSIT-SEOUL",
        "relation": "COMPLEMENTS",
        "reason": "전국 평균(+0.97%) 대비 서울(+4.8%)에서 신규 계약 전세보증금 선반영 폭이 훨씬 크게 나타났습니다."
      }
    ],
    "limitations": [
      "2020년 7월 법 개정 직후 신규 전세계약 선반영 효과이며, 당시 저금리 및 매매시장 상승 기대가 공존했던 시기의 결과입니다."
    ],
    "source": {
      "title": "주택시장과 규제",
      "publisher": "한국개발연구원(KDI)",
      "url": "https://www.kdi.re.kr/research/reportView?pub_no=18385",
      "published_at": "2023-12-30",
      "series": "연구보고서 2023-06",
      "source_type": "research_report",
      "review_status": "abstract_verified_pdf_tables_pending",
      "locator": "요약 및 제4장 주택임대차보호법 효과 분석"
    }
  },
  {
    "claim_id": "CL-KDI23-LEASE-DEPOSIT-SEOUL",
    "evidence_id": "EV-KDI-2023-06",
    "title": "주택임대차보호법 도입 직후 서울 신규 전세보증금 상승",
    "policy_type": "lease_protection_act",
    "target_region": "11",
    "sample_period": {
      "start": "2020-07-31",
      "end": "2022-07-31"
    },
    "outcome_metric": "jeonse_deposit",
    "effect_direction": "increase",
    "effect_semantics": "direct_empirical",